{
  "schemaVersion": 1,
  "experimentId": "251f82be481b224856534e5fe61c185789c591adc7fddc7b44616da2ba983185",
  "judgeManifestSha256": "f23f01f3071413e036d69f7e936ff6aad21edb39dfec980ffa8d15a4e9420946",
  "decisionId": "beb8533c0a520f575df80bff8d609703ae2a68a53189ee3d06ed343c705e01ac",
  "startedAt": "2026-09-05T00:17:38.866Z",
  "finishedAt": "2026-09-05T00:17:46.082Z",
  "durationMs": 7195,
  "providerCostUsd": null,
  "usage": {
    "inputTokens": null,
    "cachedInputTokens": null,
    "outputTokens": null,
    "reasoningTokens": null,
    "turns": null,
    "toolCalls": null
  },
  "outcome": {
    "status": "completed",
    "verdict": "same-root-cause"
  }
}
