{
  "schemaVersion": 1,
  "experimentId": "f468e08f304b9562209ad6680b6dde7c5c0b63ab0a9d6191e01f37c405bbecbe",
  "judgeManifestSha256": "9d942018b6b60200d2e7945d2a986e7baaa742f94ecfd2b0535ffb3861085326",
  "decisionId": "b9f226a5e702da2c1c71e4e43647303d37f8ee073adf8c652a594d3340bc5a21",
  "startedAt": "2026-09-04T23:46:33.277Z",
  "finishedAt": "2026-09-04T23:46:39.764Z",
  "durationMs": 6466,
  "providerCostUsd": null,
  "usage": {
    "inputTokens": null,
    "cachedInputTokens": null,
    "outputTokens": null,
    "reasoningTokens": null,
    "turns": null,
    "toolCalls": null
  },
  "outcome": {
    "status": "completed",
    "verdict": "same-root-cause"
  }
}
